[
  {
    "id": "life_orb",
    "name": "いのちのたま",
    "multiplier": 1.3,
    "applies_to": {
      "move_type": null,
      "move_id": null,
      "move_category": null,
      "all_moves": true
    },
    "side_effect": "攻撃技を使うと自分の最大HPの1/10のダメージを受ける"
  },
  {
    "id": "charcoal",
    "name": "もくたん",
    "multiplier": 1.2,
    "applies_to": {
      "move_type": "ほのお",
      "move_id": null,
      "move_category": null,
      "all_moves": false
    },
    "side_effect": null
  },
  {
    "id": "muscle_band",
    "name": "ちからのハチマキ",
    "multiplier": 1.1,
    "applies_to": {
      "move_type": null,
      "move_id": null,
      "move_category": "物理",
      "all_moves": false
    },
    "side_effect": null
  }
]
